{"id": "stock", "name": "Stock report", "content": "![Stock](plot.svg)\nThree boxes.", "version": 2, "revisions": [{"version": 1, "content": "Two boxes.", "metadata": {}}], "attachments": [{"link": "plot.svg", "file": "reports/plot.svg"}], "sections": [{"id": "counts", "ordinal": 0, "output_id": "old-output", "content_digest": "5a114893aef61d21a268eaf357a84e843bdf9dcb85fbd41e55b8d6bfbfa48f57", "metadata": {}}], "runs": [{"id": "old-run", "facts": {"state": "completed"}}], "outputs": [{"id": "old-output", "run_id": "old-run", "content": "Three boxes.", "metadata": {}}], "provenance": [{"format": "PROV-JSON", "file": "reports/original-prov.json", "sha256": "4de45e8efe694d189e5846ec499480bd09b67ea0321fcd24cddb2907075d6300"}], "template_snapshot": {"section": "counts"}, "metadata": {}}